{
  "$schema": "https://json-schema.org/draft/2020-12/schema",
  "$id": "https://crablaw.local/schemas/matter-core/review-queue.schema.json",
  "title": "CrabLaw-CN Review Queue Item",
  "type": "object",
  "required": ["reviewItemId", "matterId", "sourcePlugin", "sourceSkill", "status", "createdAt"],
  "properties": {
    "reviewItemId": { "type": "string", "pattern": "^[a-z0-9][a-z0-9._-]{1,120}$" },
    "matterId": { "type": "string", "pattern": "^[a-z0-9][a-z0-9._-]{1,100}$" },
    "sourcePlugin": { "enum": ["legal-core", "matter-core", "cn-contract", "cn-data-compliance", "cn-labor-employment", "cn-corporate", "cn-litigation", "cn-ip", "cn-regulatory", "cn-ai-governance", "cn-product", "cn-legal-aid"] },
    "sourceSkill": { "type": "string", "minLength": 1 },
    "sourceCapability": { "type": "string", "pattern": "^crablaw-cn:[a-z0-9-]+$" },
    "runId": { "type": "string", "pattern": "^[a-z0-9][a-z0-9._-]{1,120}$" },
    "issueIds": { "type": "array", "items": { "type": "string", "minLength": 2 }, "uniqueItems": true },
    "outputPath": { "type": "string", "minLength": 1 },
    "status": { "enum": ["draft", "pending-review", "returned", "approved-internal", "approved-external", "sent", "archived"] },
    "createdAt": { "type": "string", "pattern": "^\\d{4}-\\d{2}-\\d{2}$", "format": "date" },
    "reviewer": { "type": "string", "minLength": 1 },
    "reviewedAt": { "type": "string", "pattern": "^\\d{4}-\\d{2}-\\d{2}$", "format": "date" },
    "decisionActor": { "enum": ["matter-core:review-queue", "crablaw-cn:review-queue", "manual-lawyer-review"] },
    "decisionNotes": { "type": "string", "minLength": 1 },
    "externalDestination": { "type": "string", "minLength": 1 }
  },
  "allOf": [
    {
      "if": {
        "properties": { "sourcePlugin": { "const": "legal-core" } },
        "required": ["sourcePlugin"]
      },
      "then": {
        "properties": {
          "sourceSkill": { "enum": ["legal-workbench"] }
        }
      }
    },
    {
      "if": {
        "properties": { "sourcePlugin": { "const": "matter-core" } },
        "required": ["sourcePlugin"]
      },
      "then": {
        "properties": {
          "sourceSkill": { "enum": ["new-client", "new-matter", "conflict-check", "review-queue", "matter-archive", "matter-deep-analysis", "compliance-deadline-watcher"] }
        }
      }
    },
    {
      "if": {
        "properties": { "sourcePlugin": { "const": "cn-contract" } },
        "required": ["sourcePlugin"]
      },
      "then": {
        "properties": {
          "sourceSkill": { "enum": ["review", "nda-review", "clause-redraft", "risk-summary", "cold-start-interview"] }
        }
      }
    },
    {
      "if": {
        "properties": { "sourcePlugin": { "const": "cn-data-compliance" } },
        "required": ["sourcePlugin"]
      },
      "then": {
        "properties": {
          "sourceSkill": { "enum": ["data-activity-triage", "cross-border-transfer-check", "data-processing-review", "pia-generation", "privacy-policy-review"] }
        }
      }
    },
    {
      "if": {
        "properties": { "sourcePlugin": { "const": "cn-labor-employment" } },
        "required": ["sourcePlugin"]
      },
      "then": {
        "properties": {
          "sourceSkill": { "enum": ["employment-contract-review", "termination-risk-review", "non-compete-review", "employee-handbook-review", "labor-dispute-summary"] }
        }
      }
    },
    {
      "if": {
        "properties": { "sourcePlugin": { "const": "cn-corporate" } },
        "required": ["sourcePlugin"]
      },
      "then": {
        "properties": {
          "sourceSkill": { "enum": ["ai-tool-handoff", "board-minutes", "closing-checklist", "deal-team-summary", "diligence-issue-extraction", "entity-compliance", "integration-management", "material-contract-schedule", "tabular-review", "written-consent"] }
        }
      }
    },
    {
      "if": {
        "properties": { "sourcePlugin": { "const": "cn-litigation" } },
        "required": ["sourcePlugin"]
      },
      "then": {
        "properties": {
          "sourceSkill": { "enum": ["brief-section-drafter", "chronology", "claim-chart", "demand-draft", "demand-intake", "demand-received", "deposition-prep", "legal-hold", "matter-briefing", "matter-close", "matter-intake", "matter-update", "oc-status", "portfolio-status", "privilege-log-review", "subpoena-triage"] }
        }
      }
    },
    {
      "if": {
        "properties": { "sourcePlugin": { "const": "cn-ip" } },
        "required": ["sourcePlugin"]
      },
      "then": {
        "properties": {
          "sourceSkill": { "enum": ["cease-desist", "clearance", "fto-triage", "infringement-triage", "invention-intake", "ip-clause-review", "oss-review", "portfolio", "takedown"] }
        }
      }
    },
    {
      "if": {
        "properties": { "sourcePlugin": { "const": "cn-regulatory" } },
        "required": ["sourcePlugin"]
      },
      "then": {
        "properties": {
          "sourceSkill": { "enum": ["comments", "gap-surfacer", "gaps", "policy-diff", "policy-redraft", "reg-feed-watcher"] }
        }
      }
    },
    {
      "if": {
        "properties": { "sourcePlugin": { "const": "cn-ai-governance" } },
        "required": ["sourcePlugin"]
      },
      "then": {
        "properties": {
          "sourceSkill": { "enum": ["ai-inventory", "aia-generation", "policy-monitor", "policy-starter", "reg-gap-analysis", "use-case-triage", "vendor-ai-review"] }
        }
      }
    },
    {
      "if": {
        "properties": { "sourcePlugin": { "const": "cn-product" } },
        "required": ["sourcePlugin"]
      },
      "then": {
        "properties": {
          "sourceSkill": { "enum": ["feature-risk-assessment", "is-this-a-problem", "launch-review", "marketing-claims-review"] }
        }
      }
    },
    {
      "if": {
        "properties": { "sourcePlugin": { "const": "cn-legal-aid" } },
        "required": ["sourcePlugin"]
      },
      "then": {
        "properties": {
          "sourceSkill": { "enum": ["aid-application-form", "aid-intake", "case-closure", "case-memo", "case-status", "client-comms-log", "deadlines", "document-draft", "eligibility-check", "plain-language-letter", "research-start", "supervisor-review-queue"] }
        }
      }
    },
    {
      "if": {
        "properties": { "status": { "enum": ["returned", "approved-internal", "approved-external", "sent"] } },
        "required": ["status"]
      },
      "then": { "required": ["reviewer", "reviewedAt", "decisionActor"] }
    },
    {
      "if": {
        "properties": { "status": { "const": "returned" } },
        "required": ["status"]
      },
      "then": { "required": ["decisionNotes"] }
    },
    {
      "if": {
        "properties": { "status": { "enum": ["approved-external", "sent"] } },
        "required": ["status"]
      },
      "then": { "required": ["externalDestination"] }
    }
  ],
  "additionalProperties": false
}
